{"artifact": "OMEGA-GLYPH-V1000-OMNI-CODEX", "artifact_type": "UKG_Nano_Crystal_Proposal", "version": "1000.3.0", "evidence_status": "planned", "physical_nodes": {"Node_A_Frontend": {"stack": ["React", "Zustand", "Tailwind_v4"], "claimed_core_logic": "Anya_Codec_UI + Chrome_Native_Messaging_Bridge", "evidence_class": "planned"}}}